{
  "schema_version": "candidate-screening-spec.v1",
  "spec_id": "accela-algorithm-screening-static-2026-08-11-v1",
  "pass_registry_sha256": "f3175eaad399ad34b5cba3227f7f6e8f3b7f492ca50196c197b9de5d0b7496a3",
  "candidates": [
    {
      "candidate_id": "bitset",
      "oracle_family_id": "bitset",
      "implementation_candidate_id": null,
      "family_kind": "bitset",
      "overlaps_existing_pass_ids": [],
      "duplicate_of": null,
      "eligible_oracle_structure_refs": [],
      "structural_disposition": "blocked",
      "structural_reason": "blocked_locked_bitset_capability_gap"
    },
    {
      "candidate_id": "boom_ilp",
      "oracle_family_id": "boom_ilp",
      "implementation_candidate_id": "candidate.integer-reduction-expansion",
      "family_kind": "standard",
      "overlaps_existing_pass_ids": [
        "ir.reduction-pushdown",
        "ir.loop-unroll"
      ],
      "duplicate_of": null,
      "eligible_oracle_structure_refs": [
        {
          "oracle_family_id": "boom_ilp",
          "structure_id": "dot_unroll4"
        },
        {
          "oracle_family_id": "boom_ilp",
          "structure_id": "reduction_multi_acc"
        }
      ],
      "structural_disposition": "eligible",
      "structural_reason": null
    },
    {
      "candidate_id": "closed_form",
      "oracle_family_id": "closed_form",
      "implementation_candidate_id": "candidate.extended-affine-summarization",
      "family_kind": "standard",
      "overlaps_existing_pass_ids": [
        "ir.indvar-domain-simplify",
        "ir.affine-loop-summarization",
        "ir.strength-reduction"
      ],
      "duplicate_of": null,
      "eligible_oracle_structure_refs": [
        {
          "oracle_family_id": "closed_form",
          "structure_id": "linear_sum"
        },
        {
          "oracle_family_id": "closed_form",
          "structure_id": "quadratic_sum"
        },
        {
          "oracle_family_id": "closed_form",
          "structure_id": "triangular_recurrence"
        }
      ],
      "structural_disposition": "eligible",
      "structural_reason": null
    },
    {
      "candidate_id": "dp_storage",
      "oracle_family_id": "dp_storage",
      "implementation_candidate_id": "candidate.dp-storage-contraction",
      "family_kind": "standard",
      "overlaps_existing_pass_ids": [
        "ir.sroa",
        "ir.dead-store-elimination",
        "ir.loop-load-elimination"
      ],
      "duplicate_of": null,
      "eligible_oracle_structure_refs": [
        {
          "oracle_family_id": "dp_storage",
          "structure_id": "reverse_single_row"
        },
        {
          "oracle_family_id": "dp_storage",
          "structure_id": "three_row"
        },
        {
          "oracle_family_id": "dp_storage",
          "structure_id": "two_row"
        }
      ],
      "structural_disposition": "eligible",
      "structural_reason": null
    },
    {
      "candidate_id": "finite_state",
      "oracle_family_id": "finite_state",
      "implementation_candidate_id": "candidate.finite-state-acceleration",
      "family_kind": "standard",
      "overlaps_existing_pass_ids": [
        "ir.affine-loop-summarization",
        "ir.loop-unroll"
      ],
      "duplicate_of": null,
      "eligible_oracle_structure_refs": [
        {
          "oracle_family_id": "finite_state",
          "structure_id": "affine_mod97"
        },
        {
          "oracle_family_id": "finite_state",
          "structure_id": "branch_mod53"
        },
        {
          "oracle_family_id": "finite_state",
          "structure_id": "quadratic_mod31"
        }
      ],
      "structural_disposition": "eligible",
      "structural_reason": null
    },
    {
      "candidate_id": "fusion",
      "oracle_family_id": "fusion",
      "implementation_candidate_id": "candidate.same-domain-loop-fusion",
      "family_kind": "standard",
      "overlaps_existing_pass_ids": [
        "ir.dead-store-elimination",
        "ir.loop-interchange",
        "ir.loop-unroll-and-jam",
        "ir.loop-load-elimination"
      ],
      "duplicate_of": null,
      "eligible_oracle_structure_refs": [
        {
          "oracle_family_id": "fusion",
          "structure_id": "single_temporary"
        },
        {
          "oracle_family_id": "fusion",
          "structure_id": "stencil_producer"
        },
        {
          "oracle_family_id": "fusion",
          "structure_id": "two_temporaries"
        },
        {
          "oracle_family_id": "boom_ilp",
          "structure_id": "independent_chains"
        }
      ],
      "structural_disposition": "eligible",
      "structural_reason": null
    },
    {
      "candidate_id": "linear_transition",
      "oracle_family_id": "linear_transition",
      "implementation_candidate_id": "candidate.integer-linear-transition",
      "family_kind": "standard",
      "overlaps_existing_pass_ids": [
        "ir.ranked-recurrence-tabulation",
        "ir.affine-loop-summarization"
      ],
      "duplicate_of": null,
      "eligible_oracle_structure_refs": [
        {
          "oracle_family_id": "linear_transition",
          "structure_id": "affine_2d"
        },
        {
          "oracle_family_id": "linear_transition",
          "structure_id": "affine_scalar"
        },
        {
          "oracle_family_id": "linear_transition",
          "structure_id": "fibonacci_2d"
        }
      ],
      "structural_disposition": "eligible",
      "structural_reason": null
    },
    {
      "candidate_id": "memoization",
      "oracle_family_id": "memoization",
      "implementation_candidate_id": "candidate.rrt2-on-demand-memoization",
      "family_kind": "standard",
      "overlaps_existing_pass_ids": [
        "ir.ranked-recurrence-tabulation"
      ],
      "duplicate_of": null,
      "eligible_oracle_structure_refs": [
        {
          "oracle_family_id": "memoization",
          "structure_id": "binomial"
        },
        {
          "oracle_family_id": "memoization",
          "structure_id": "grid_paths"
        }
      ],
      "structural_disposition": "eligible",
      "structural_reason": null
    },
    {
      "candidate_id": "prefix_scan",
      "oracle_family_id": "prefix_scan",
      "implementation_candidate_id": "candidate.prefix-scan-reuse",
      "family_kind": "standard",
      "overlaps_existing_pass_ids": [
        "ir.reduction-pushdown",
        "ir.loop-strength-reduce",
        "ir.loop-load-elimination"
      ],
      "duplicate_of": null,
      "eligible_oracle_structure_refs": [
        {
          "oracle_family_id": "prefix_scan",
          "structure_id": "forward_prefix"
        },
        {
          "oracle_family_id": "prefix_scan",
          "structure_id": "reverse_suffix"
        },
        {
          "oracle_family_id": "prefix_scan",
          "structure_id": "weighted_prefix"
        }
      ],
      "structural_disposition": "eligible",
      "structural_reason": null
    },
    {
      "candidate_id": "recursion_worklist",
      "oracle_family_id": "recursion_worklist",
      "implementation_candidate_id": null,
      "family_kind": "mixed",
      "overlaps_existing_pass_ids": [
        "ir.ranked-recurrence-tabulation",
        "ir.tail-recursion-elimination"
      ],
      "duplicate_of": null,
      "eligible_oracle_structure_refs": [],
      "structural_disposition": "rejected",
      "structural_reason": "mixed_family_no_unified_transform"
    },
    {
      "candidate_id": "structured_kernel",
      "oracle_family_id": "structured_kernel",
      "implementation_candidate_id": null,
      "family_kind": "mixed",
      "overlaps_existing_pass_ids": [
        "ir.loop-interchange",
        "ir.loop-unroll-and-jam",
        "ir.loop-unroll",
        "ir.loop-load-elimination"
      ],
      "duplicate_of": null,
      "eligible_oracle_structure_refs": [],
      "structural_disposition": "rejected",
      "structural_reason": "mixed_family_no_unified_transform"
    }
  ]
}
